Semesters/Fa26/EMCH792/projects/boat_control/source/digitized_slides/slide_trace_decay_v.csv

x,y
5.821474773609314202e-02,4.495848161328587778e-01
9.702457956015522744e-02,4.306049822064056398e-01
1.358344113842173129e-01,4.139976275207591372e-01
1.746442432082794260e-01,3.973902728351126346e-01
2.134540750323415115e-01,3.807829181494661319e-01
2.522639068564035969e-01,3.641755634638196293e-01
2.910737386804657101e-01,3.487544483985764443e-01
3.298835705045277678e-01,3.321470937129299417e-01
3.686934023285898809e-01,3.179122182680901298e-01
4.075032341526519941e-01,3.048635824436535802e-01
4.463130659767140518e-01,2.906287069988137128e-01
4.851228978007761650e-01,2.775800711743771632e-01
5.239327296248382781e-01,2.657176749703439311e-01
5.627425614489003358e-01,2.550415183867140723e-01
6.015523932729623935e-01,2.443653618030841579e-01
6.403622250970245622e-01,2.336892052194542713e-01
6.791720569210866199e-01,2.241992882562277023e-01
7.179818887451486775e-01,2.147093712930011333e-01
7.567917205692108462e-01,2.064056939501778820e-01
7.956015523932729039e-01,1.969157769869513130e-01
8.344113842173349616e-01,1.897983392645313794e-01
8.732212160413971302e-01,1.826809015421114457e-01
9.120310478654591879e-01,1.755634638196915120e-01
9.508408796895212456e-01,1.684460260972715784e-01
9.896507115135833033e-01,1.613285883748516725e-01
1.028460543337645472e+00,1.553973902728350565e-01
1.067270375161707641e+00,1.494661921708184404e-01
1.106080206985769587e+00,1.435349940688018244e-01
1.144890038809831756e+00,1.387900355871885538e-01
1.183699870633893925e+00,1.340450771055752555e-01
1.222509702457955871e+00,1.293001186239619849e-01
1.261319534282018040e+00,1.245551601423486865e-01
1.300129366106079987e+00,1.198102016607354020e-01
1.338939197930142155e+00,1.162514827995254352e-01
1.377749029754204324e+00,1.115065243179121507e-01
1.416558861578266271e+00,1.079478054567021839e-01
1.455368693402328439e+00,1.043890865954922309e-01
1.494178525226390608e+00,1.020166073546855817e-01
1.532988357050452555e+00,9.727164887307229724e-02
1.571798188874514723e+00,9.489916963226564806e-02
1.610608020698576892e+00,9.252669039145901275e-02
1.649417852522638839e+00,8.896797153024904592e-02
1.688227684346701007e+00,8.540925266903907909e-02
1.727037516170763176e+00,8.303677342823244378e-02
1.765847347994825123e+00,8.066429418742579460e-02
1.804657179818887291e+00,7.829181494661914542e-02
1.843467011642949460e+00,7.591933570581251012e-02
1.882276843467011407e+00,7.473309608540919247e-02
1.921086675291073576e+00,7.236061684460254328e-02
1.959896507115135744e+00,6.998813760379590798e-02
1.998706338939197691e+00,6.880189798339257645e-02
2.037516170763259638e+00,6.642941874258594115e-02
2.076326002587321806e+00,6.524317912218260962e-02
2.115135834411383975e+00,6.287069988137597432e-02
2.153945666235446144e+00,6.168446026097264973e-02
2.192755498059508312e+00,6.049822064056932513e-02
2.231565329883570481e+00,5.812574139976268289e-02
2.270375161707632206e+00,5.693950177935936524e-02
2.309184993531694374e+00,5.575326215895604065e-02
2.347994825355756543e+00,5.456702253855272300e-02
2.386804657179818712e+00,5.338078291814939841e-02
2.425614489003880880e+00,5.100830367734275617e-02
2.774902975420439510e+00,4.389086595492282944e-02
2.852522639068563848e+00,4.151838671411618720e-02
2.891332470892626016e+00,4.151838671411618720e-02
2.930142302716688185e+00,4.033214709371286261e-02
2.968952134540749910e+00,3.914590747330953802e-02
3.007761966364812078e+00,3.914590747330953802e-02
3.046571798188874247e+00,3.795966785290622036e-02
3.085381630012936416e+00,3.677342823250289577e-02
3.124191461836998585e+00,3.677342823250289577e-02
3.163001293661060309e+00,3.677342823250289577e-02
3.201811125485122478e+00,3.558718861209957812e-02
3.240620957309184647e+00,3.440094899169625353e-02
3.279430789133246815e+00,3.440094899169625353e-02
3.318240620957308984e+00,3.440094899169625353e-02
3.357050452781371153e+00,3.321470937129293588e-02
3.395860284605432877e+00,3.202846975088961129e-02
3.434670116429495046e+00,3.202846975088961129e-02
3.473479948253557215e+00,3.202846975088961129e-02
3.512289780077619383e+00,3.202846975088961129e-02
3.551099611901681552e+00,3.084223013048629017e-02
3.589909443725743721e+00,2.965599051008296905e-02
3.628719275549805445e+00,2.965599051008296905e-02
3.667529107373867614e+00,2.965599051008296905e-02
3.706338939197929783e+00,2.965599051008296905e-02
3.745148771021991951e+00,2.965599051008296905e-02
3.783958602846054120e+00,2.846975088967964793e-02
3.822768434670116289e+00,2.728351126927632680e-02
3.861578266494178013e+00,2.728351126927632680e-02
3.900388098318240182e+00,2.728351126927632680e-02
3.939197930142302351e+00,2.728351126927632680e-02
3.978007761966364519e+00,2.728351126927632680e-02
4.016817593790426244e+00,2.728351126927632680e-02
4.055627425614488857e+00,2.609727164887300221e-02
4.094437257438550581e+00,2.491103202846968109e-02
4.133247089262613194e+00,2.491103202846968109e-02
4.172056921086674919e+00,2.491103202846968109e-02
4.210866752910736643e+00,2.491103202846968109e-02
4.249676584734799256e+00,2.491103202846968109e-02
4.288486416558860981e+00,2.491103202846968109e-02
4.327296248382923594e+00,2.491103202846968109e-02
4.366106080206985318e+00,2.372479240806635997e-02
4.404915912031047043e+00,2.253855278766303885e-02
4.443725743855109656e+00,2.253855278766303885e-02
4.482535575679171380e+00,2.253855278766303885e-02
4.521345407503233993e+00,2.253855278766303885e-02
4.560155239327295718e+00,2.253855278766303885e-02
4.598965071151358330e+00,2.253855278766303885e-02
4.637774902975420055e+00,2.253855278766303885e-02
4.676584734799481780e+00,2.253855278766303885e-02
4.715394566623544392e+00,2.135231316725971773e-02
4.754204398447606117e+00,2.135231316725971773e-02
4.793014230271668730e+00,2.016607354685639661e-02
4.831824062095730454e+00,2.016607354685639661e-02
4.870633893919792179e+00,2.016607354685639661e-02
4.909443725743854792e+00,2.016607354685639661e-02
4.948253557567916516e+00,2.016607354685639661e-02
4.987063389391979129e+00,2.016607354685639661e-02
5.025873221216040854e+00,2.016607354685639661e-02
5.064683053040103466e+00,2.016607354685639661e-02
5.103492884864165191e+00,2.016607354685639661e-02
5.142302716688226916e+00,1.897983392645307549e-02
5.181112548512289528e+00,1.897983392645307549e-02
5.219922380336351253e+00,1.779359430604975090e-02
5.258732212160413866e+00,1.779359430604975090e-02
5.297542043984475590e+00,1.779359430604975090e-02
5.336351875808537315e+00,1.779359430604975090e-02
5.375161707632599928e+00,1.779359430604975090e-02
5.413971539456661652e+00,1.779359430604975090e-02
5.452781371280724265e+00,1.779359430604975090e-02
5.491591203104785990e+00,1.779359430604975090e-02
5.530401034928848603e+00,1.779359430604975090e-02
5.569210866752910327e+00,1.779359430604975090e-02
5.608020698576972052e+00,1.779359430604975090e-02
5.646830530401034665e+00,1.660735468564642978e-02
5.685640362225096389e+00,1.660735468564642978e-02
5.724450194049159002e+00,1.660735468564642978e-02
5.763260025873220727e+00,1.542111506524310865e-02
5.802069857697282451e+00,1.542111506524310865e-02
5.840879689521345064e+00,1.542111506524310865e-02
5.879689521345406789e+00,1.542111506524310865e-02
5.918499353169469401e+00,1.542111506524310865e-02
5.957309184993531126e+00,1.542111506524310865e-02
5.996119016817592851e+00,1.542111506524310865e-02
6.034928848641655463e+00,1.542111506524310865e-02
6.073738680465717188e+00,1.542111506524310865e-02
6.112548512289779801e+00,1.542111506524310865e-02
6.151358344113841525e+00,1.542111506524310865e-02
6.190168175937904138e+00,1.542111506524310865e-02
6.228978007761965863e+00,1.542111506524310865e-02
6.267787839586027587e+00,1.423487544483978753e-02
6.306597671410090200e+00,1.423487544483978753e-02
6.345407503234151925e+00,1.423487544483978753e-02
6.384217335058214537e+00,1.304863582443646641e-02
6.423027166882276262e+00,1.304863582443646641e-02
6.461836998706337987e+00,1.304863582443646641e-02
6.500646830530400599e+00,1.304863582443646641e-02
6.539456662354462324e+00,1.304863582443646641e-02
6.578266494178524937e+00,1.304863582443646641e-02
6.617076326002586661e+00,1.304863582443646641e-02
6.655886157826649274e+00,1.304863582443646641e-02
6.694695989650710999e+00,1.304863582443646641e-02
6.733505821474772723e+00,1.304863582443646641e-02
6.772315653298835336e+00,1.304863582443646641e-02
6.811125485122897061e+00,1.304863582443646641e-02
6.849935316946959674e+00,1.304863582443646641e-02
6.888745148771021398e+00,1.304863582443646641e-02
6.927554980595083123e+00,1.304863582443646641e-02
6.966364812419145736e+00,1.304863582443646641e-02
7.005174644243207460e+00,1.186239620403314529e-02
7.043984476067270073e+00,1.186239620403314529e-02
7.082794307891331798e+00,1.186239620403314529e-02
7.121604139715393522e+00,1.186239620403314529e-02
7.160413971539456135e+00,1.067615658362982417e-02
7.199223803363517860e+00,1.067615658362982417e-02
7.238033635187580472e+00,1.067615658362982417e-02
7.276843467011642197e+00,1.067615658362982417e-02
7.315653298835704810e+00,1.067615658362982417e-02
7.354463130659766534e+00,1.067615658362982417e-02
7.393272962483828259e+00,1.067615658362982417e-02
7.432082794307890872e+00,1.067615658362982417e-02
7.470892626131952596e+00,1.067615658362982417e-02
7.509702457956015209e+00,1.067615658362982417e-02
7.548512289780076934e+00,1.067615658362982417e-02
7.587322121604138658e+00,1.067615658362982417e-02
7.626131953428201271e+00,1.067615658362982417e-02
7.664941785252262996e+00,1.067615658362982417e-02
7.703751617076325608e+00,1.067615658362982417e-02
7.742561448900387333e+00,1.067615658362982417e-02
7.781371280724449946e+00,1.067615658362982417e-02
7.820181112548511670e+00,1.067615658362982417e-02
7.858990944372573395e+00,1.067615658362982417e-02
7.897800776196636008e+00,9.489916963226501315e-03
7.936610608020697732e+00,9.489916963226501315e-03
7.975420439844760345e+00,9.489916963226501315e-03
8.014230271668822070e+00,9.489916963226501315e-03
8.053040103492884683e+00,9.489916963226501315e-03
8.091849935316945519e+00,8.303677342823180194e-03
8.130659767141008132e+00,8.303677342823180194e-03
8.169469598965070745e+00,8.303677342823180194e-03
8.208279430789133357e+00,8.303677342823180194e-03
8.247089262613194194e+00,8.303677342823180194e-03
8.285899094437256807e+00,8.303677342823180194e-03
8.324708926261319419e+00,8.303677342823180194e-03
8.363518758085380256e+00,8.303677342823180194e-03
8.402328589909442869e+00,8.303677342823180194e-03
8.441138421733505481e+00,8.303677342823180194e-03
8.479948253557566318e+00,8.303677342823180194e-03
8.518758085381628931e+00,8.303677342823180194e-03
8.557567917205691543e+00,8.303677342823180194e-03
8.596377749029754156e+00,8.303677342823180194e-03
8.635187580853814993e+00,8.303677342823180194e-03
8.673997412677877605e+00,8.303677342823180194e-03
8.712807244501940218e+00,8.303677342823180194e-03
8.751617076326001055e+00,8.303677342823180194e-03
8.790426908150063667e+00,8.303677342823180194e-03
8.829236739974126280e+00,8.303677342823180194e-03
8.868046571798188893e+00,8.303677342823180194e-03
8.906856403622249729e+00,8.303677342823180194e-03
8.945666235446312342e+00,8.303677342823180194e-03
8.984476067270374955e+00,8.303677342823180194e-03
9.023285899094435791e+00,7.117437722419859072e-03
9.062095730918498404e+00,7.117437722419859072e-03
9.100905562742561017e+00,7.117437722419859072e-03
9.139715394566623630e+00,7.117437722419859072e-03
9.178525226390684466e+00,7.117437722419859072e-03
9.217335058214747079e+00,7.117437722419859072e-03
9.256144890038809692e+00,7.117437722419859072e-03
9.294954721862870528e+00,5.931198102016537084e-03
9.333764553686933141e+00,5.931198102016537084e-03
9.372574385510995754e+00,5.931198102016537084e-03
9.411384217335056590e+00,5.931198102016537084e-03
9.450194049159119203e+00,5.931198102016537084e-03
9.489003880983181816e+00,5.931198102016537084e-03
9.527813712807244428e+00,5.931198102016537084e-03
9.566623544631305265e+00,5.931198102016537084e-03
9.605433376455367878e+00,5.931198102016537084e-03
9.644243208279430490e+00,5.931198102016537084e-03
9.683053040103491327e+00,5.931198102016537084e-03
9.721862871927553940e+00,5.931198102016537084e-03
9.760672703751616552e+00,5.931198102016537084e-03
9.799482535575679165e+00,5.931198102016537084e-03
9.838292367399740002e+00,5.931198102016537084e-03
9.877102199223802614e+00,5.931198102016537084e-03
9.915912031047865227e+00,5.931198102016537084e-03
9.954721862871926064e+00,5.931198102016537084e-03
9.993531694695988676e+00,5.931198102016537084e-03
1.003234152652005129e+01,5.931198102016537084e-03
1.007115135834411213e+01,5.931198102016537084e-03
1.010996119016817474e+01,5.931198102016537084e-03
1.014877102199223735e+01,5.931198102016537084e-03
1.018758085381629996e+01,5.931198102016537084e-03
1.022639068564036080e+01,5.931198102016537084e-03
1.026520051746442341e+01,5.931198102016537084e-03
1.030401034928848603e+01,5.931198102016537084e-03
1.034282018111254686e+01,5.931198102016537084e-03
1.038163001293660948e+01,5.931198102016537084e-03
1.042043984476067209e+01,5.931198102016537084e-03
1.045924967658473470e+01,5.931198102016537084e-03
1.049805950840879554e+01,5.931198102016537084e-03
1.053686934023285815e+01,4.744958481613215096e-03
1.057567917205692076e+01,4.744958481613215096e-03
1.061448900388098160e+01,4.744958481613215096e-03
1.065329883570504421e+01,4.744958481613215096e-03
1.069210866752910682e+01,4.744958481613215096e-03
1.073091849935316766e+01,4.744958481613215096e-03
1.076972833117723027e+01,4.744958481613215096e-03
1.080853816300129289e+01,4.744958481613215096e-03
1.084734799482535550e+01,4.744958481613215096e-03
1.088615782664941634e+01,4.744958481613215096e-03
1.092496765847347895e+01,3.558718861209893974e-03
1.096377749029754156e+01,3.558718861209893974e-03
1.100258732212160240e+01,3.558718861209893974e-03
1.104139715394566501e+01,3.558718861209893974e-03
1.108020698576972762e+01,3.558718861209893974e-03
1.111901681759379024e+01,3.558718861209893974e-03
1.115782664941785107e+01,3.558718861209893974e-03
1.119663648124191369e+01,3.558718861209893974e-03
1.123544631306597630e+01,3.558718861209893974e-03
1.127425614489003713e+01,3.558718861209893974e-03
1.131306597671409975e+01,3.558718861209893974e-03
1.135187580853816236e+01,3.558718861209893974e-03
1.139068564036222497e+01,3.558718861209893974e-03
1.142949547218628581e+01,3.558718861209893974e-03
1.146830530401034842e+01,3.558718861209893974e-03
1.150711513583441103e+01,3.558718861209893974e-03
1.154592496765847187e+01,3.558718861209893974e-03
1.158473479948253448e+01,3.558718861209893974e-03
1.162354463130659710e+01,3.558718861209893974e-03
1.166235446313065793e+01,3.558718861209893974e-03
1.170116429495472055e+01,3.558718861209893974e-03
1.173997412677878316e+01,3.558718861209893974e-03
1.177878395860284577e+01,3.558718861209893974e-03
1.181759379042690661e+01,3.558718861209893974e-03
1.185640362225096922e+01,3.558718861209893974e-03
1.189521345407503183e+01,3.558718861209893974e-03
1.193402328589909267e+01,3.558718861209893974e-03
1.197283311772315528e+01,3.558718861209893974e-03
1.201164294954721790e+01,3.558718861209893974e-03
1.205045278137128051e+01,3.558718861209893974e-03
1.208926261319534134e+01,3.558718861209893974e-03
1.212807244501940396e+01,3.558718861209893974e-03
1.216688227684346657e+01,3.558718861209893974e-03
1.220569210866752741e+01,3.558718861209893974e-03
1.224450194049159002e+01,3.558718861209893974e-03
1.228331177231565263e+01,3.558718861209893974e-03
1.232212160413971347e+01,3.558718861209893974e-03
1.236093143596377608e+01,3.558718861209893974e-03
1.239974126778783869e+01,3.558718861209893974e-03
1.243855109961190131e+01,3.558718861209893974e-03
1.247736093143596214e+01,3.558718861209893974e-03
1.251617076326002476e+01,3.558718861209893974e-03
1.255498059508408737e+01,3.558718861209893974e-03
1.259379042690814821e+01,3.558718861209893974e-03
1.263260025873221082e+01,3.558718861209893974e-03
1.267141009055627343e+01,3.558718861209893974e-03
1.271021992238033604e+01,3.558718861209893974e-03
1.274902975420439688e+01,3.558718861209893974e-03
1.278783958602845949e+01,3.558718861209893974e-03
1.282664941785252211e+01,3.558718861209893974e-03
1.286545924967658294e+01,3.558718861209893974e-03
1.290426908150064556e+01,3.558718861209893974e-03
1.294307891332470817e+01,3.558718861209893974e-03
1.298188874514877078e+01,3.558718861209893974e-03
1.302069857697283162e+01,3.558718861209893974e-03
1.305950840879689423e+01,3.558718861209893974e-03
1.309831824062095684e+01,3.558718861209893974e-03
1.313712807244501768e+01,3.558718861209893974e-03
1.317593790426908029e+01,3.558718861209893974e-03
1.321474773609314290e+01,3.558718861209893974e-03
1.325355756791720374e+01,3.558718861209893974e-03
1.329236739974126635e+01,3.558718861209893974e-03
1.333117723156532897e+01,3.558718861209893974e-03
1.336998706338939158e+01,3.558718861209893974e-03
1.340879689521345242e+01,3.558718861209893974e-03
1.344760672703751503e+01,3.558718861209893974e-03
1.348641655886157764e+01,3.558718861209893974e-03

Sp26/EMCH792/textbook_output/markdown/ch11_the_h_filter/ch11_full.md

## 11.1.1 An Alternate Form For The Kalman Filter

$$\begin{array}{rcl}\mathcal{I}_{k+1}&=&F_{k}x_{k}+w_{k}\\ y_{k}&=&H_{k}x+v_{k}\end{array}\tag{11.1}$$

$$\begin{array}{r l}{K_{k}}&{{}=}\\ {}&{{}=}\\ {}&{{}=}\\ {}&{{}=}\\ {}&{{}=}\\ {}&{{}=}\\ {}&{{}=}\\ {}&{{}=}\end{array}$$
P H (HkP H H + Rk) -1 B2 H2 B2, - L2 H2 B2, H2(1 + B2 H2 B2, H2 B2, [1 - P = H + B = H = (1 + B = H = B = H = ] P = H ; B = ] [(1 + B + H B B 2 Hx) - B - H + B - H + B - H - B - H - B - H - B - (I + P H R R H R ) - 1 P H R R 1 (11.4)
Substituting this into the expression for Px+1 in Equation (11.2) we get

$$P_{k+1}^{-}$$
= FkP F F + Qk Fk (I - Kk Hk) Px F + Qk FxPx Fx - FxKkHkPx Fx + Qk == Fr P2 E2 - E2 (1 + B2 H2 B2, H2) - } P2 H2 B2, HrB2 F2 + Of Fr P = Fk(In + HE B2 Hk) -1 H2 B2 Hk P2 + Qk (11.5) ==
Apply the matrix inversion lemma again to the inverse on the right side of the above equation to obtain

$$P_{k+1}^{-}$$
= FkPx Ff - Fx [P, - Px H2 (Rk + HkPx H2 )-1HkP2 ] H2 Rx + HkPx Fx + Qk FkPE [I - H] RE HkPi + == H2 (Rk + HkPz H2 )-1 HkP Hk Rz Hk Pk] Fx + Qk Fk Px TxFf + Qk (11.6)  11
where Tk is defined by the above equation. Apply the matrix inversion lemma to the inverse that is in Tk to obtain

Tk = 1 - H; Rx HxPx + HE [RT - RE HK(TE + HE RT-Hk)- +H2 RT ] HkPT H2 RT HkPk I - H2 R2 HkPx + (H2 RE HkPx )2 - ll HE RE Hk (TE + H& RE Hk)-1 (Hx RE HkPr )2 I - H2 R2 HkPx + (Hk Rx 1 HkPx )2 -  ll HE B2 Hx P2 (1 + H2 R2, HxB2 )- ) (H2 B2 )2 I - HE RT HkP + + (Hk Rx HkPr )2 -  II (HT RE Hr B2 )3(I + HE BE 1 HkP2 )-1 [(1 + H2 R2 Hk P2 ) - H2 B2 Hk P2 (1 + H2 B2 ) + ll (H) Bx +HkP2 )2(1 + H2 R2 H2 P2 ) - (H2 B2 HkP2 )3] × (I + H R R - H R P ) - 3 = (I + H R R ] HkP )-1 (11.7)
Substituting this expression for Tk into Equation (11.6) gives

Combining this expression for Kk with Equations (11.2) and (11.8) we can summarize the Kalman filter as follows:

## 11.2.2 Inequality Constraints

Suppose that we want to minimize a scalar function that is subject to an inequality constraint: 
min J(x) such that f(x) 5 0 (11.24) 
This can be reduced to two minimization problems, neither of which contain inequality constraints. The first minimization problem is unconstrained, and the second minimization problem has an equality constraint:

The procedure for solving Equation **(11.24)** involves solving the unconstrained problem first. Then we check to see if the unconstrained minimum satisfies the constraint. If the unconstrained minimum satisfies the constraint, then the unconstrained minimum solves the inequality-constrained minimization problem and we are done. However, if the unconstrained minimum does not satisfy the constraint, then the minimization problem with the inequality constraint is equivalent to the minimization problem with the equality constraint. So we solve the problem with the equality constraint *f(z)* = 0 to obtain the final solution. This is illustrated for the scalar case in Figure 11.1.

## 11.2.3 Dynamic Constrained Optimization

$$J_{a}=\psi(x_{0})+\sum_{k=0}^{N-1}\left[{\cal L}_{k}+\lambda_{k+1}^{T}(F_{k}x_{k}+w_{k}-x_{k+1})\right]\tag{11.27}$$

$$\begin{array}{r l}{{\frac{\partial J_{a}}{\partial x_{k}}}}&{{}=}\\ {{\frac{\partial J_{a}}{\partial w_{k}}}}&{{}=}\\ {{\frac{\partial J_{a}}{\partial\lambda_{k}}}}&{{}=}\end{array}$$
$\begin{array}{ll}\mbox{\rm(}k=0,\cdots,N\mbox{\rm)}\\ \mbox{\rm(}k=0,\cdots,N-1\mbox{\rm)}\\ \mbox{\rm(}k=0,\cdots,N\mbox{\rm)}\end{array}$ (11.31)
These conditions can also be written as

## 11.3 **A Game Theory Approach To H, Filtering**

Our goal is to estimate a linear combination of the state. That is, we want to estimate **Zk,** which is given by zk = *Lkxk* (11.35)

$J^{*}=\min\max J$  $\hat{\pi}_{k}$$w_{k},w_{k},\pi_{0}$  $\hat{\pi}_{k}$$w_{k},w_{k},\pi_{0}$ 
$$(11.39)$$
Since Zk = *LkXk,* we naturally choose ik = *Lk2k* and try to find the 2k that minimizes J. This gives us the problem

## 11.3.1 Stationarity With Respect To 20 **And** Wk

$$\frac{2\lambda_{0}^{T}}{\theta}+\frac{\partial\psi_{0}}{\partial x_{0}}=0$$ $$\frac{2\lambda_{N}^{T}}{\theta}=0$$ $$\frac{\partial\mathcal{H}_{k}}{\partial\omega_{k}}=0$$ $$\frac{2\lambda_{k}^{T}}{\theta}=\frac{\partial\mathcal{H}_{k}}{\partial x_{k}}\tag{11.47}$$

In 240000 (21.17) we obtain  $\begin{matrix}-\dfrac{2}{\theta}Q_k^{-1}w_k+\dfrac{2}{\theta}\lambda_{k+1}&=&0\\ w_k&=&Q_k\lambda_{k+1}\end{matrix}$  into the process dynamics equation to obtain ... 
This can be substituted into the process dynamics equation to obtain 
xk+1 = FkXk -k *Qkxk+i* **(11.51)** 
From the fourth expression in Equation **(11.47)** we obtain

xk = pk + *Pkxk* ( **11.53)** 
for all k, where pk and Pk are some functions to be determined, with PO given, and the initial condition po = **20.** That is, we assume that Xk is an affine function of *xk.* This assumption may or may not turn out to be valid. We will proceed as if the assumption were true, and if our results turn out to be correct then we will know that our assumption was indeed valid. Substituting Equation **(11.53)** into Equation **(11.51)** gives

## Stationarity With Respect To 5 **And Y** 11.3.2

$$\begin{array}{l l l}{{\lambda_{k+1}^{T}(P_{k+1}-Q_{k})\lambda_{k+1}}}&{{=}}&{{\lambda_{k+1}^{T}(Q_{k}+F_{k}\tilde{P}_{k}F_{k}^{T}-Q_{k})\lambda_{k+1}}}\\ {{}}&{{=}}&{{\lambda_{k+1}^{T}F_{k}\tilde{P}_{k}F_{k}^{T}\lambda_{k+1}}}\end{array}$$
$$(11.74)$$

(1 1.77) 
Notice that the above expression is a scalar. That means that each term on the right side is a scalar, which means that each term is equal to its transpose. For example, consider the second term on the right side. Since it is a scalar, we see that e(pk - 2k)TSkPkXk = ex:Pksk(pk - *2k).* (we have used the fact that Pk and Sk are symmetric, and 8 is a scalar.) Equation **(11.77)** can therefore be written as

in Equation *(11.63),* the condition required for ?k to minimize J is that (P;' - esk + *H?R;lHk)-l* be positive definite. This is So, from the definition of equivalent to requiring that *(PF'* - esk + *H?RilHk)* be positive definite. The individual terms in this expression are always positive definite [note in particular from Equation **(11.62)** that Pk will be positive definite if 4 is positive definite].

Note from Equation **(11.62)** that the positive definiteness of pk implies the positive definiteness of *%+I.* Therefore, if Po is positive definite (per our original problem statement), and pk is positive definite for all k, then Pk will also be positive definite for all k.

$$(11.86)$$
$$\begin{array}{r c l}{{\frac{\partial^{2}J}{\partial y_{k}^{2}}}}&{{=}}&{{\frac{2}{\theta}(R_{k}^{-1}H_{k}\tilde{P}_{k}H_{k}^{T}R_{k}^{-1}-R_{k}^{-1})}}\\ {{}}&{{}}&{{}}\\ {{}}&{{}}&{{=}}&{{\frac{2}{\theta}R_{k}^{-1}(H_{k}\tilde{P}_{k}H_{k}^{T}-R_{k})R_{k}^{-1}}}\end{array}$$

## 11.3.4 Steady-State H, Filtering

$$\begin{array}{r l}{{\bar{S}}}&{{}=}\\ {K}&{{}=}\\ {{\hat{x}}_{k+1}}&{{}=}\\ {P}&{{}=}\end{array}$$
S = L~SL 
$L^{T}SL$  $P\left[I-\theta\bar{S}P+H^{T}R^{-1}HP\right]^{-1}H^{T}R^{-1}$  $F\hat{x}_{k}+FK_{k}(y_{k}-H\hat{x}_{k})$  $FP\left[I-\theta\bar{S}P+H^{T}R^{-1}HP\right]^{-1}F^{T}+Q$ (11.93)
$$P^{-1}-\theta\bar{S}+H^{T}R^{-1}H>0$$

## The Transfer Function Bound Of The H, Filter 11.3.5

Figure **11.2** Example 11.2 results. Khan and H, filter peformance when the noise statistics are known. The Kalman gain is **0.62** and the H, gain is 0.82. The Kalman filter performs about 12% better than the H, filter.

Figure **11.3** Example 11.2 results. Kalman and H, filter peformance when the process noise is biased. The Kalman gain is 0.62 and the H, gain is 0.82. The H, filter performs about 23% better than the Kalman filter. 
R, and S are all identity matrices. Recall that the two-norm of a column vector x 
is defined as 
$$||x||_{2}^{2}=x^{T}x$$
Now suppose we have a timevarying vector **50, XI, 22,** a. The signal two-norm of 
x is defined as 
$$(11.103)$$
$$(11.104)$$
$$||x||_{2}^{2}=\sum_{k=0}^{\infty}||x_{k}||_{2}^{2}$$
That is, the square of the signal two-norm is the sum of all of the squares of the vector two-norms that are taken at each time step.3 Now suppose that we have a system with input u and output 5, and the transfer function is *G(z).* If the input u is comprised entirely of signals at the frequency w and the sample time of the system is T, then we define the phase of u as q5 = *Tw.* In this case the maximum gain from u to x is determined as